id,sentence,dialect,source
151,રામાયણ ઉપર મજાક કરવા વાળા સંસ્કાર ની વાત કરે છે,charotari,balanced
152,એક જાત નો લુખ્ખો છે,charotari,balanced
153,જેવો માણસ એવો વિચાર હલકી ના,charotari,balanced
154,"મતલબ ગામડાના ભોળા માણસોને રામાયણનું જ્ઞાન હોય છે . તેમને કથા સાંભળવા જવાની જરુર નથી ,",charotari,balanced
155,ભાઈ ના આવડે તો સ્ટેજ ઉપરથી નીચે ઉતરી ને જતા રહો,charotari,balanced
156,આ ભાષા મહેસાણા ની નથી..આ કોઈ સમાજ ની ભાષા માં વાત કરે છે,charotari,balanced
157,આવું કોણ બોલે છે મહેસાણા મા આવી ઘર ની ભાસે વાપરે છે સરમ. આવી જોયે,charotari,balanced
158,એક તો આવાને લાખો રૂપિયા આપવાના અને સનાતન નું આપમાન્ કરવાનું,charotari,balanced
159,માયાભાઈ સાચું કહું છે!,charotari,balanced
160,આ મહેસાણી ભાષા નથી.,charotari,balanced
161,એ કોડા આ મેહસાણા ની ભાષા છેજ નઈ કોડા ફેંકવાનું બંધ કર,charotari,balanced
162,માયા આહીર અને હિતેશ કંટાળી યુ બંને મહેસાણા નથી બોલાવતા,charotari,balanced
163,નો આવડતું હોય તો નો બોલાય અમે આવુ નહિ બોલતા ઉત્તર ગુજરાત થી જ ગુજરાત ની ઓળખાણ સે,charotari,balanced
164,"આ મહા મૂર્ખના સરદારને મહેસાણા ભાષા આવડતી નથી, અને જાહેરમાં પોતાની બુદ્ધિનું પ્રદર્શન કરી રહ્યો છે. આને કોઈ પાગલખાનામાં લઈ જાઓ.",charotari,balanced
165,સનાતની નથી નહિતર આપણા પવિત્ર ગ્રંથ વિશે આવી મશ્કરી વાળી ભાષા નો વાપરે.. કલાકાર માથે લાંછનનનનનનન,charotari,balanced
166,આપણા દેવી દેવતા ને મજાકમાં લેવા નહીં.,charotari,balanced
167,મહેસાણા ભારત દેસ નુ રદય છે મહેસાણા ની ભાસ્યા સિખવા મહેસાણા માં જન્મ લેવો પડે,charotari,balanced
168,લોકો ને ઉલ્લુ બનાવીને રૂપિયા કમાઈ લીધા.... મહેસાણા ની ભાષા છે જ નહિ... તમારી ભાષા માં જ રામાયણ છે..,charotari,balanced
169,મહેસાણા ના કોઈ આવુ નથી બોલતુ તમે માયાભાઈ ખોટી બોલી ઊભી નથી કરો ્્્મારા મહેસાણા એ તો દેશને વડાપ્રધાન આપ્યો છે......,charotari,balanced
170,કલાકાર એટલે ખોટી ફાંકા ફોજદારી,charotari,balanced
171,કલાકર એટલે પૈસા ના યાર,charotari,balanced
172,જે માણસ સે વાર્તા ને સાચી માની લે છે તે અભણ ની નિશાની છે.,charotari,balanced
173,મહેસાણા ની ભાષા નથી આ કોઈ બીજા સમાજ ની ભાષા છે,charotari,balanced
174,આપડા બનાવેલા આપણને બનાવે છે,charotari,balanced
175,પયસા.. માટે.. આવી.. બૉલે.. છે. હોય.. ભાષાનૂ.. અપમાન.. ન.કરો,charotari,balanced
176,ભાઈ શ્રી આ ભાષા નથી મહેસાણા ની,charotari,balanced
177,આ મહેસાણાની ભાષા નથી પણદેવી પૂજક ભાષાછે,charotari,balanced
178,ભાઈ નુ મગજ ગાસ ચરવા ગયુ છે આપણી ભુલ એ છે કે આવા ગાંડા માણસ ના કાર્યક્રમ જોવા સાંભળવા જઈ એ છિયે,charotari,balanced
179,Hu બનાસ કાંઠા નો છું.પણ મેહાના માં છું પણ આવી ભાષા નથી....,charotari,balanced
180,ગમે એની મજાક ઉડાવે છે આ ફાલતુ,charotari,balanced
181,સારું છે મુસ્લિમ મોલાના એ આ રીતે પ્રવચન નથી કર્યો,charotari,balanced
182,વિનાશકારી વિપરીત બુદ્ધિ,charotari,balanced
183,પૈસા માટે ધર્મ નું અપમાન કરો છો,charotari,balanced
184,મેહોની ભાષા બોલતા શીખો અને પછી બોલો ભાઈ અને ના આવડે તો આવો ટાઈમ કાઢીને અમારા મહેસાણા મા શીખવાડી ને મોકલીશુ,charotari,balanced
185,સાવ કેવી નિમ્ન ધર્મ ની હસી કરે છે,charotari,balanced
186,માયા ભાઈ માપ રાખો.આ અમારી ભાષા નથી.,charotari,balanced
187,આ વેવલા પણુજ કરતો હોય જય માતાજી,charotari,balanced
188,આ મહેસાણા ની ભાશા છેજ નથી,charotari,balanced
189,માયાભાઇ મહેસાણા ની ભાષા નથી,charotari,balanced
190,મહેસાણા ને તમે નહિ સમજી શકો. માયાભાઈ.,charotari,balanced
191,માયાભાઇ આ મહેસાણા ની ભાષા નથી.,charotari,balanced
192,આના દરેક કાર્યક્રમ boycott કરવો જોઈએ.,charotari,balanced
193,આમેસાણાનીભાષાનથી.ડફોર,charotari,balanced
194,ભાઈ આ કાલ્પનિક વાતો કરી ને પૈસા કમાવા નો ધંધો છે.,charotari,balanced
195,આ મહેસાણા નુ એક્સેન્ટ નથી યાર,charotari,balanced
196,આ લોક સાહિત્ય નથી. આ એક બોલી ની મજાક ઉડાવે છે. આને લોકસાહિત્યકાર ન કહેવાય. 😢😢,charotari,balanced
197,નવરી ના જે પ્રોગ્રામ કરતો હોય તે કર બીજા ની ભાષા ઉપર ના જા,charotari,balanced
198,હળાહળ જુઠ્ઠું ન બોલો મયા ભાઇ મહેસાણાની ભાષા આવી છે જ નહિ,charotari,balanced
199,ભાષા ને ના પકડો એમની કોમેડી ની મજા લો ભાઈ એમને મનમા પન કોઈની ભાષાની મજાક ઉડાડવાનુ ના હોય ભાઈ એ મજા કરાવા આયા સે મજા માનો,charotari,balanced
200,વિષય ખોટો પસંદ કર્યો છે.,charotari,balanced
201,આ મહેસાણા ની ભાષા જ નથી,charotari,balanced
202,માયા ભાઈ આવી વાતુ ના કરાય સંશકારી છો,charotari,balanced
203,6 મહિના નાં સોકર નો કાય ખબર ના પડે ભાઈ આવો ખોટો બફાટ કરવો રેવા દયો,charotari,balanced
204,્આવીરીતેરામાયણનુઅપમાનનકરાય,charotari,balanced
205,આ મેહસાણા ની ભાષા સેજ નઈ,charotari,balanced
206,મ્હેસનવલાનેકેમનેચડેખડવામાગોછો તમેક્યારેમ્હસાનમકથાસભલીછે,charotari,balanced
207,ગુજરાત માં અલગ અલગ જગ્યાએ અલગ ભાષા બોલાય છે એમાં મહેસાણા ની ભાષા વિષે એવું બોલવું યોગ્ય નથી તમારા ભાષા તમને સારી લાગતી હોય એનો મતલબ બધાને સારી લાગે એવો અભિમાન ના કરાય ભાઈ,charotari,balanced
208,સર્જી આ ભાષા મહેસાણા ની છે. પણ લોકલ ભાષા નથી.આપ જે બોલો છો તે વાઘરી ની ભાષા છે.,charotari,balanced
209,બધી બાબતો માં ઘુસણખોરી ના થાય,charotari,balanced
210,પહેલા બેસતા શીખો,charotari,balanced
211,આ તો વેવલો જ છે. એની ગરવલીથી દુઃખી લાગે છે અને અહી વરાળ નીકળી છે,charotari,balanced
212,"આ ભાષા મહેસાણા ની નથી, મહેસાણા નો મજાક ના ઉડાવો",charotari,balanced
213,આ મહેસાણાની ભાષા નથી.,charotari,balanced
214,ભાઈ આએકદ ખોટી વાત છે ભાઈ મેસાણાની લેગવેજ નથી તમારી જોવો લેગવેજ પછી મહેસાણાની વાત કરજો આવો મહેસાણામા જોવો પછી બોલો તમારા ગામની વાતનો 👎👎👎,charotari,balanced
215,આ મહેસાણા ની ભાષા નથી,charotari,balanced
216,આ મહેસાણી ભાષા નથી,charotari,balanced
217,માયા તારી પાસે મગજ છે,charotari,balanced
218,પહેલા તો આ અમારી મહેસાણા જિલ્લાની ભાષા જ નથી.... બિજુ ઘમૅ ની મજાક ઉડાવિને .. ઘંઘા બંધ કરો,charotari,balanced
219,આપણી સંસ્કૃતિ ની મજાક ઉડાવી નેજ આટલી લોક પ્રિયતા મેળવી છે,charotari,balanced
220,માયાભાઈ તમે મહેસાણા ની ભાષા જે બોલો છો ને વાઘરીઓ બોલે એવી ભાષા બોલો 0 હસલ મહેસાણી ભાષા તમને આવડતી જ નહીં,charotari,balanced
221,મહેસાણાની ભાષા તમને નથી આવડતી,charotari,balanced
222,આપણા હિન્દુ ધર્મ ના પવિત્ર ગ્રંથ રામાયણની મજાક ઉડાવે છે એ હવે કેમ કોઈ દળો ને દેખાતુ નથી? ખોટું કરી રહયા છે માયાભાઈ આહીર તમે તો દ્વારકાધીશ ના પરમ ભક્તો છો અને હિન્દુ ધર્મ વિશે મજાક ઉડાવી રહયા છો,charotari,balanced
223,સૌથી પહેલા આપડા ધર્મ ની મજાક કરે છે તે ખોટી વસ્તુ છે. અને આ જોવા અને સંભાળવા માટે બધા જાય છે. જવું જ ના જોઈએ. અને આવી ભાષા મહેસાણા ની નથી. કોઈ જિલ્લા ની કે કોઈ ભાષા વિશે ખરાબ ના કહેવુ જોઈએ,charotari,balanced
224,એ બુદ્ધિ વગરના હિન્દુ છો?,charotari,balanced
225,ખોટી રજૂઆત છે આવી ભાષા હોતી જ નથી,charotari,balanced
226,તમે પેસા માટે પવિત્ર રામાયણ ને હાસ્ય માટે ઉપયોગ કરો છો.આ યોગ્ય નથી.,charotari,balanced
227,અમારા મોજીલા મેહોના વાળા ની ઉડાવા ની જરૂર નથી માયા ભાઇ વિશ્વ સૌથી સુંદર ભાષા છે,charotari,balanced
228,માયા ભાઈ આ દીલ ની વાત.....ખોપડી માં કાણાં.....એને ના સમજાય જય શ્રી દ્વારકાધીશ,charotari,balanced
229,વાહ માયા ભાઈ વાહ,charotari,balanced
230,મહેસાણા ભાષા આવી નથી અને મહેસાણા વાળા મૂરખા નથી તુ મૂરખો છે,charotari,balanced
231,"મહેસાણા આવી જ છે, મૂર્ખ માયાભાઈ આહિર નહીં,મૂર્ખ તો તુ છે! 😆😆😆😂",charotari,balanced
232,સુરેન્દ્રનગર નરોડા અને મહેસાણા ની સ્ત્રી ઓ ની ભાષા બહુ ગમ્ય હોઈ છે,charotari,balanced
233,આ ભાષા આધ્યાત્મ અને ભક્તિની છે..,charotari,balanced
234,"ભાષા નહીં, ભાવ પકડો, ગામથી બોલીમાં ઘણા શાસ્ત્રો નો સાર છે, ધન્ય હો ગોપાલ,",charotari,balanced
235,મેહોણી એટલે મેહોણી હો ભઈ,charotari,balanced
236,પિલુન્દ્રા ગામ ...જય સદ્ ગુરુદેવ....,charotari,balanced
237,"Jordar....vachn ... નાની ઉંમર માં મોટા વચન.. આટલો હેવી મેસેજ આટલી સરળ તાથી... વાહ ગુરુ વાહ...👍🏻👍🏻👍🏻 મેહસાણા ,, બનાહકોથી",charotari,balanced
238,જય સ્વામિનારાયણ,charotari,balanced
239,જય હો મારા વાલા જય હો 🙏🙏🙏🙏🙏🙏🙏🙏🙏🙏🙏🙏🙏🙏🙏🙏,charotari,balanced
240,હૈ.કુસણ.ધણી.ઇજજત.આબરુ.તમે.બધાની.રાખજો,charotari,balanced
241,આતો સાબરકાંઠા ની ભાષા હો ભાઈ જય સદગુરુદેવ,charotari,balanced
242,હા તમારું સાબરકાંઠા...,charotari,balanced
243,જય હો ગોપાલદાસ બાપુ ખુબ સરસ વાણિ તમારી ભાષામાં ખૂબ જ અમૃત રસ છે,charotari,balanced
244,ભાઈ આતો સાબરકાંઠાની બોલી છે......,charotari,balanced
245,અસ્સલ mehoni ભાષા છે.....,charotari,balanced
246,જય સદ્દગુરુ દેવ,charotari,balanced
247,ઈડર ની ભાષા છે મહેસાણા ની નથી,charotari,balanced
248,ભાષા નહીં ઉપદેશ મહત્વ ધરાવે છે,charotari,balanced
249,ભાઈ આ સાબરકાઠા ભાષા છે.,charotari,balanced
250,"વાહ જબબરજસ્ત, મજા આવી ગઈ",charotari,balanced
251,સત ની વાણી જય હો ગોપાલ બાપુ,charotari,balanced
252,પણ તમે લોકો ની વાત કેમ કરો છે,charotari,balanced
253,વિડિયો બનાવનાર ભાષા ઓળખી શકતા નથી આ ઈડર મલક અટલે સાબરકાંઠા જિલ્લા ની ભાષા છે,charotari,balanced
254,આ અસલ સાબરકાંઠાની ભાષા છે મેહોણાની નથી. મારા બાજુના ગામમાં જ રયે છે. પિલુદ્રા.,charotari,balanced
255,આ સાબરકાંઠા જિલ્લાની ભાષા છે મહેસાણા ની નથી,charotari,balanced
256,ગોંધીનગર સાબરકાંઠોની ભાષા છે પ્રભુ.,charotari,balanced
257,@bipintaviyad968 સાબરકાંઠામાં પણ છે જ.,charotari,balanced
258,પ્રાંતિજ જોડે છે પીલુદ્રા,charotari,balanced
259,@PatelVoice1988 ભેદની વાત જ નથી.. લોકોને ખયાલ આવે એટલે લખ્યું છે.,charotari,balanced
260,જય સદગુરૂ મહારાજ,charotari,balanced
261,વિચારો હલકટ ના સીનાલવા જેવા સે,charotari,balanced
262,છાંટા છાંટા આયેગા.. Mushad ધાર નઈ આયેગા....,charotari,balanced
263,મંગાઓ ખાઈ નાખીએ थोड़ा थोड़ा 😂😂,charotari,balanced
264,😂😂 અમારે કો લાગતા હૈ કી આપના ભાઈબંધ કદાચ ઘર પે બીવી સે લડાઈ કરકે આયે હૈ બાકી આપકા વિડિયો જોરદાર હૈ જોન્ટી ભાઈ 😂😂😂❤🎉,charotari,balanced
265,મુંબઈ જેવો વરસાદ પડવો જોઈએ,charotari,balanced
266,પાર્ટનર મૂડ માં નથી લાગતા આજે 😅,charotari,balanced
267,ડોડા સેકવાના સીઝન આવી ગયા હે,charotari,balanced
268,એક ઉંમરલાયક વ્યક્તિને આપ આ રીતે હેરાન શા માટે કરો છો,charotari,balanced
269,કોઈ ને હેરાન કરવા મઝા આવે આવું તમારી સાથે પણ થશે આવા વિડિયો ને રિપોર્ટ મારો unlike karo,charotari,balanced
270,એક દમ સાચી વાત કરી👌👌👌👌,charotari,balanced
271,સાચી વાત છે જોન્ટી ભાઇ 👌👌👌👍👍,charotari,balanced
272,ભાઈ તમારા વિડીયો મને ખુબજ ગમે છે,charotari,balanced
273,ફુલ મૌજ માં હો ભઈ 😂😂😂,charotari,balanced
274,"😂😂😂 આજે એવા લાગતા હૈ કી ભુક્કા નીકળે ગા ઓર જોન્ટી ભાઈ એન્ડ કંપની દાળવડાં, બટાકા વડા કી પાર્ટી એન્જોય કરેગી 😂😂😂😂😂",charotari,balanced
275,વાહ દિનકરભાઈ વાહ તમારા જોક્સ સાંભળીને ખૂબ હસીએ છીએ ખરેખર ખૂબ મજા આવે છે અફસોસ એટલો છે કે અમદાવાદમાં હતા ત્યારે અમે કાર્યક્રમ જોઈ ના શક્યા હવે અમદાવાદ પ્રોગ્રામ કરો તો અમને જરૂર જણાવજો વિડીયો અપલોડ કરતા ને અમારા ધન્યવાદ જય હિન્દ વંદે માતરમ્ કોબા ગાંધીનગર થી ગાભાજી ઠાકોર ક્ષત્રિય,charotari,balanced
276,મને આ ગીત બોવ જ ગમે સે મસ્ત સે હો. જોડીદાર ❤❤❤❤❤,charotari,balanced
277,હુ મહારાષ્ટ્રા થી છૂ પણ મને ગુજરાતી ગમેછે ❤😊,charotari,balanced
278,હું આ એકજ ગીત સાંભળું સુ,charotari,balanced
279,જોવો મારી ડબિંગ વિડીયો કેવી છે 😂 -,charotari,balanced
280,વાઘરી તારી બેન નો હાથ પકડ્યો,charotari,balanced
281,વનરાજભાઈ ખાવડીયા 😆😆😆😆😀😃😄😜,charotari,balanced
282,આવો અને મને ચુંબન કરો,charotari,balanced
283,"101% સાચી વાત, આમજ કરવું પડે.",charotari,balanced
284,ચલો ભાઈ એ બહાને પૈસા તો નીકળી ગયા,charotari,balanced
285,ફરી નઈ માંગે હવે 😅😅😅,charotari,balanced
286,હાર્દિકભાઈ ભૂલશો નહીં મારે પણ ઉઘરાણી બાકી છે. તમારો ખુબ ખુબ આભાર.😮,charotari,balanced
287,જોરદાર અને જબરજસ્ત છે,charotari,balanced
288,જય શ્રી કષ્ટભંજન દેવ હનુમાનજી 🙏,charotari,balanced
289,જય શ્રી કષ્ટભંજન દેવ,charotari,balanced
290,જય હનુમાન દાદા સારંગપુર,charotari,balanced
291,જય શ્રી રામ જય હનુમાન દાદા,charotari,balanced
292,જય શ્રી કસ્તભંજન દેવ,charotari,balanced
293,જય મહારાજ. જય બજંગ. જય શ્રી રામ.,charotari,balanced
294,જય શ્રી રામ.... કષ્ઠભંજન દેવ ની જય....,charotari,balanced
295,મુના ભાઇ ગણા દિવસો બાદ દેખાણા,charotari,balanced
296,ભાઈ ભાઈ ભાઈ ભાઈ,charotari,balanced
297,ઊજેનનાડોનોવીડીયોબનાવોભાઈદૂલભકશય,charotari,balanced
298,"""બીડી નથ પીવી હાલ નીકળ....""🤣🤣🤣👌",charotari,balanced
299,@badhackeryt બેન દીકરી યુ જોતી હોય ને ભાઈ ઇ જોવાયને,charotari,balanced
300,મનોરંજન એની જગ્યાએ બરાબર છે ભાઈ પણ આવા વિડિઓ ના મુકો તો સારું...,charotari,balanced
301,@jaydeepjd5300 ભૈલા ક્લિક થાય પછી ડિસ્કલેઇમર આવે...થમ્બનેઇલ મા જ લખી દે ગાળો છે એમ...,charotari,balanced
302,લાયા લાયા બાવા હિન્દી લાયા...😂😂😂,charotari,balanced
303,જેટલા આવડતા હે એટલા બોલનેકા 🤣🤣,charotari,balanced
304,ગુજરાત નું શાન્તિ નિકેતન,charotari,balanced
305,લક્ષ્મી ની ચાર રહી ગઈ ભાઈ 😉,charotari,balanced
306,પેટલાદ રાધા ઘાટ એ વિડિયો બનાવા આવો❤,charotari,balanced
307,મારી મજા પડી ગઈ ખુશી માં. નુતન વર્ષાભિનંદન.,charotari,balanced
308,અમિત ભાઈ તમારી ‌બોલવાની સટાયલ આ વિડીયો મા અલગ લાગી,charotari,balanced
309,અમદાવાદી ભાઈ મજા પડી...,charotari,balanced
310,મને મઝા પડી.. ધન્યવાદ ભાઈ શ્રી,charotari,balanced
311,મને અમિત ભાઈ ના જોક્સ ખુબ ગમે છે,charotari,balanced
312,બોવજ મજા પડી. અમિત ભાઈ.,charotari,balanced
313,મને મજા પડી જય રણછોડ,charotari,balanced
314,મને મઝા પડી nice 💞💞👍👍,charotari,balanced
315,મને બૌજ મઝા પડી અમિત ભાઈ,charotari,balanced
316,મને બહુજ મજા આવી.,charotari,balanced
317,"મને મજા પડી, અમિત ભાઇ તમારા દરેક વિડીયો હું છેક સુધી જોવુ છુ, આખા દિવસનો થાક રાત્રે તમારા જોક્શ સાંભળી ભુલાય જાય.",charotari,balanced
318,મજા તો પડી પણ પાટણ રાણકીવાવ વિશે કંઇક બોલો ભાઈ તમારા જોક્સ રોજ સાભરું છું ખુબ મજા આવે છે,charotari,balanced
319,રાજકોટ વિશે બોલો,charotari,balanced
320,અમીત ભાઈ આજે ગુજરાતી ભાઈ ઓ અંગ્રેજી મા ગુજરાતી કેમ લખે છે જેમકે Bov maza aave se આ ગુજરાતી મા લખવા મા શુ વાંધો આપણે ગુજરાતી છીએ તેનુ ગૈરવ કેમ નથી સમજાતુ નથી હશે તમારી વાત મા ટકોર કરશો આભાર,charotari,balanced
321,અમિત ભાઈ યાર માજા નાં આવી કેમ ખબર નઇ આજે આ વીડિયો માં સાલું હસુજ નાં આવ્યું,charotari,balanced
