id,sentence,dialect,source
484,"ગાંધીનગર 
આજ સુધી ગુજરાત ના કોઇ પણ કલાકારે કાઠિયાવાડી ભાષાની ઠેકડી ઉડાવી છે ?હલકટ પ્રવૃતિ છોડો.",charotari,topup
485,"માયા ની માયા મોય ગઇ
મારો રામ",charotari,topup
486,"મજાક મસ્તી માટે બરાબર છે , પણ સહેજ પણ મહેસાણી ભાષા જેવું નથી, જે એરિયા નો જે બોલવાનો લહેકો હોય એ કોઈથી પણ કોપી ના થઈ શકે, મહેસાણી ભાષા માં,  હ , અને સ , આ બે શબ્દો મહત્વના",charotari,topup
487,"માયાભાઈ તમે મહેસાણા ની ભાષા અને રામાયણ બંનેનું અપમાન કરી રહ્યા છો 

તમે એક સારા કલાકાર છો આવું વર્તન તમારાથી ન થાય",charotari,topup
488,મેહસાણા  ની ભાષા  સરસ શે ભાઈ,charotari,topup
489,"ભાઈ આતો ડાયરો કેવાય આમાં કંઈ ખોટું
નાં લગાડવાનું હોય 😊
   આમાં તો હસી મજાક ચાલે.",charotari,topup
490,"માયાભાઈ મજામાને 
અમારા મહેસાણાની આવી ભાષા નથી આપ મનોરંજન માટે બોલો તે બરાબર છે",charotari,topup
491,આ મહેસાણાની ભાષા નથી  પણદેવી પૂજક ભાષાછે,charotari,topup
492,"આવી મજાક મસ્તી વાળા  કલાકાર ને સ્ટેજ પર થી નીચે ઉતારવો જોઇએ..
સાંભળવા વારા ને પણ થોડીક શરમ આવવી જોઇએ..
ઘણી વખત માયા એ માફી માંગી છે..",charotari,topup
493,Hu બનાસ કાંઠા નો  છું.પણ મેહાના માં છું પણ આવી ભાષા નથી....,charotari,topup
494,આ મહેસાણા ની ભાષા નથી જુઠ્ઠા  તમે કેટલા માણસ ડફોળ બનાવીશ?,charotari,topup
495,આ લોકો બીજાની મજાક ઉડાવી ને હાસ્ય બનાવે છે  અને મૂર્ખા લોકો દાંત કાઢે છે,charotari,topup
496,પૈસા  માટે  ધર્મ  નું  અપમાન  કરો છો,charotari,topup
497,Tamariભાષા  સંભાળ  ભાઈ,charotari,topup
498,ગુજરાત માં અલગ અલગ જગ્યાએ   અલગ ભાષા બોલાય છે એમાં મહેસાણા ની ભાષા વિષે એવું બોલવું યોગ્ય નથી તમારા ભાષા તમને સારી લાગતી હોય એનો મતલબ બધાને સારી લાગે એવો અભિમાન ના કરાય ભાઈ,charotari,topup
499,આ આખા  મહેસાણા ની ભાષા નથી આ એક સમાજ ની ભાષા છે,charotari,topup
500,"હળાહળ જુઠ્ઠું ન બોલો મયા ભાઇ
મહેસાણાની ભાષા આવી છે જ નહિ",charotari,topup
